keyword,review,star,date,site,score
농심 신라면,항상 먹는거라 다른 상품이랑 같이 사서 더 싸게 샀네요. 배송도 빨라서 좋았습니다.,5,220616,롯데마트,0.0
농심 신라면,"남편이 신라면만 먹어서 떨어지지 않게 꼭 쟁여놔야해요
전 좀 덜 매웠으면 좋겠어요",5,200910,롯데마트,0.0
농심 신라면,면이 별로지만 스프맛이 좋아서 어쩔수없이 삼. 면 바꾸지않으면 조만간 외면당할듯,4,210528,롯데마트,5.0
농심 신라면,이마트 배송 진짜 빨라서 좋아요 집에 아기본다고 밖에도 못나가는데 참 편리하네요,5,220317,이마트몰,3.0
농심 신라면,신라면 맛은 어디에 내 놓아도 떨어지지 않죠. 매번 이것만 주문해서 먹고 있어요. ^^,5,221109,11번가,4.0
농심 신라면,아들이 제일 좋아하는 라면이에요 다 먹구서 재구매 할게요 배송도 빠르고 굿입니다,5,220329,Homeplus,5.0
농심 신라면,매콤한 맛을 좋아해서 신라면을 항상 비축하고 먹는데요~ 택배가 너무 늦게 오네요~~,4,210910,옥션,0.0
농심 신라면,친정집에 네이버 장보기로 이것저것 주문해드렸어요. 라면도 싸길래 얼릉 담았네요.,5,220923,이마트몰,0.0
농심 신라면,저희 집은 신라면을 좋아해요..그래서 세일할때면 꼭 삽니다^^맛있게 잘 먹을께요~~^^,4,211114,G마켓,4.333333333333333
농심 신라면,너무싸게 구입했어요 쌀 시키면서 시킨건데 물건도 빨리받아보구..완죤 맘에듭니다.,5,220318,이쌀이다,0.0
농심 신라면,"저렴하게 구매했습니다
새로 나온 하면들 먹더가도 어느새 신라면으로 손이 가네요",5,201215,SSG닷컴,0.0
농심 신라면,"박스가찢어진상태로왔어요
택배박스는첫인상인데말이죠!!
안에비닐포장이있어서그나마다행입니다
박스포장에더신경쓰셔야할듯요..",4,210108,플랜 88,2.0
농심 신라면,쌀.잡곡과 함께우리집 제2의 곡식이 된 신라면아들들이 매일 먹어서 걱정 되는데또 사라고 해서 샀죠.라면 중 최고.,5,211229,G마켓,3.3333333333333335
농심 신라면,사진 참고하시면 아시겠지만 1박스 포장 제대로되어있고 거기 위에 또 박스해주셔서 안전 배송까지 완료입니다,5,211019,G마켓,4.5
농심 신라면,라면이 조각조각 나 있네요. 이미 부스러진걸 포장한것 같은데 여러개가 이렇습니다. 반품하고 싶지만 귀찮아서,1,210303,G마켓,0.0
농심 신라면,요즘 같이 쌀쌀할때 청량초넣고 끓이면 최고지요. 4개입라면도 많이 나오지만 굳굳이 5개인 신라면 너무 맛나요.,5,210111,11번가,5.0
농심 신라면,"2달 입원하시고 퇴원하신 어머님이 라면을 전혀드신적이 없었는데 요즘 신라면만 찾으셔서 구매하고 있어요. 2개 구매하면 세일하는 기간이 지났나보네요.
잘 먹고 있어요.예전 맛하고는 조금 달라졌어요.",3,211102,롯데마트,4.0
농심 신라면,홈플러스 구입은 처음이었는데 배송도 빠르고 좋았어요~요즘 라면가격도 너무 많이 올랐는데 합리적인 가격으로 잘 구매했습니다.,5,221029,Homeplus,4.0
농심 신라면,"일주일간 타사 제품과 비교하다가 결국 이 제품으로 구매했는데, 정말 잘 결정했다는 생각이 드네요.감사합니다.",5,211212,달달스토어,4.0
농심 신라면,월요일에 주문했고 금요일에 발송이 되어서 토요일에 도착했습니다. 주문처리에 4일이 걸린셈입니다. 그런데 이에 대해서 구매자에게 아무런 대처도 하지 않네요.유통기한은 6개월이 안됩니다.,4,210905,인터파크,0.0
농심 신라면,유통기한은 좀 길진않은거 같네요.. 7월달까지라.. 재고 처리 느낌이네요 그 전에 열심히 먹으면 다 먹을듯 합니다,5,200225,재형유통,4.0
농심 신라면,주문할껄 후회되네요 ㅠ어머니께서 라면 좀 먹자해서 주문했는데여기저기 치였는지 좀 많이 부서져서 ㅎㅎㅎ뭐 숟가락으로 먹죠,5,220309,G마켓,2.0
농심 신라면,이마트 쓱배송 너무 편리하고 상품도 좋아요시간도 정확하게 오구요 밥맛도 최고요,5,200818,11번가,4.666666666666667
농심 신라면,직접 매장에 가야하는 불편없이 온라인으로 좋은 조건에 판매해서 정말 편리하네요,5,210307,롯데마트,3.0
농심 신라면,"쓱머니써서 구매했어요 배송비가 있어서, ,
라면이 다 비싸네요 당일에 받고 좋아요",5,210413,SSG닷컴,0.0
농심 신라면,"집콕에 거의 한끼는 라면인데, 질리지 않는 맛이에요.
항상 구비해두니, 든든합니다.",5,201225,SSG닷컴,1.0
농심 신라면,네이버에서 저렴하게 슥배송 시켜서 편하고 좋았어요 다음에도 세일 많이 해주세요,5,211228,이마트몰,5.0
농심 신라면,스테디셀러에는 이유가 있지요. 포장 정성스레 되어 와서 면 별로 안 깨진거 같아요,5,220524,SSG 새벽배송,0.0
농심 신라면,1박스 포장에 손잡이까지 있어서 선물용으로도 좋을듯 합니다. 신라면은 진리죠~~^^,5,220615,G마켓,4.0
농심 신라면,쿠폰과 함께 저렴히 잘 샀어요또 구매하러 온 김에 상품평 적고갑니다많이 파세요!!,5,221020,G마켓,4.0
농심 신라면,장보기로 빠르게 배송받을수있었습니다:)유통기한도 넉넉한제품이어서 좋네요？？,5,220917,11번가,3.0
농심 신라면,아예한박스 시킴.주말마다 신랑이 라면을 찾아서쿠폰쓰니 좋구.유효기간 적당하공.,3,201107,11번가,0.0
농심 신라면,"배송은 생각보다 좀 걸렸네요.
믿고 먹는 신라면~~ㅋ
저렴한 가격에 잘 구매했습니다.",3,201223,플랜 88,4.0
농심 신라면,어렸을때부터 먹어서 인지 이 맛에 익숙해진거같아요 마트 쇼핑시 항상 구매합니다,5,200812,11번가,0.0
농심 신라면,오배송에 따른 교환신청에서 일주일가량 걸린 사건만 아니면 괜찮았던 제품입니다.,5,201222,릴코컴퍼니,0.0
농심 신라면,늘 맛있게 먹던 거지만 5개인줄 알았는데 6개짜리가 와서 ㅋㅋ 득템한듯 기분좋네요,4,210530,Homeplus,5.0
농심 신라면,요새 생라면 부숴먹는 재미가 쏠쏠해요ㅋㅋ 바삭하니 맛나여 가격도 행사가라 저렴,5,210617,Homeplus,5.0
농심 신라면,잘먹을게요 배송 편한데 리뷰는 한번에 다쓰게 했으면 해요 여러번쓰기 번거로워요,5,201112,Homeplus,2.5
농심 신라면,농심 가격이 많이 올랐는데 상대적으로 신라면이 저렴하고 맛도 좋아서 구매했어요,5,221010,Homeplus,5.0
농심 신라면,트레이더스는 상대적으로 가격이 저렴해서 좋습니다. 신라면은 상비하는 편이예요.,5,210103,SSG닷컴,0.0
농심 신라면,코로나로 쟁여 놓을 비상식량으로 구매... 유통기한 까지 다 먹을수 있을까?걱정임..,5,200827,SSG닷컴,1.0
농심 신라면,신라면 오랜만에 주문했는데 역시 깔끔하고 얼큰합니다!! 유통기한 22년12월9일까지~,5,220702,G마켓,0.0
농심 신라면,유통기한도 넉넉하고 봉지 깠을때 면이 안깨져 있어서 좋아요! 다음에 또 시킬게요~,5,220928,푸드슈퍼마켓,4.0
농심 신라면,"늘 구매하는 제품이라 할인할때 잘 맞춰서 사고 있어요.
맛은 뭐 다들 아시는 그맛!!!",5,210721,롯데ON,4.0
농심 신라면,"너구리만 먹다가 오랜만에
신라면이 먹고 싶어 구매했는데
역시 실망시키지 않네요^^",5,220909,GSSHOP,2.5
농심 신라면,농심 신라면을 다른분들도 같이 드시면 맛있는 식사대용도 좋고 부작용이 없습니다,5,201025,SSG닷컴,3.6666666666666665
농심 신라면,"어릴 때부터 쭉 먹고 있는 최애라면이에요
과자처럼 부셔먹어도 완전 맛있어요 ㅠㅠ",5,220219,이마트몰,0.0
농심 신라면,"신제품라면먹어봐도역시이맛에익숙한듯되돌아구매하네요
기름기만조금줄였으면ㅠ",5,200111,SSG닷컴,2.0
농심 신라면,"매운맛 거의 안 먹지만
먹을 땐 신라면+ 치즈
꼬들한 면이 오랜만에 먹어도 역시 맛있",5,221018,Homeplus,0.0
농심 신라면,생각보다 짐이되는 라면을 집에서 시키니 너무좋습니다빠르게보내주셔서 감사해요,5,200907,G마켓,2.0
농심 신라면,"구매한지 꽤 됐어요.
여러 곳 비교후 유통기한 길고 가격 좋은 곳으로 선택했습니다.",5,220305,옥션,5.0
농심 신라면,코로나로 인해 마트에 가기엔 좀 그랬는데 잘 샀고 시간 맞춰서 배송와줘서 좋네요.,5,200921,롯데마트,4.0
농심 신라면,"적극추천합니다
배송도빠르고
포장도잘해오시고
가격도착하고
자구구매하는것같아요",5,210520,롯데마트,4.0
농심 신라면,말이 필요 없는... 맛있어요. 물가가 많이 오르기도 했지만 가격이 오른게 아쉬워요.,5,221020,이마트몰,0.0
농심 신라면,"생각보다 라면봉지 상태가 깔끔하게 와서
넘좋았고 맛있었습니다
담에도 또시킬듯",5,221130,GSSHOP,5.0
농심 신라면,역시 심라면 아닙니까? 좋아요. 내년 5월까지 유통기한이던데 열심히 먹어야 겠어요,4,221208,11번가,4.0
농심 신라면,이런 시국에 직접 마트로 안가고 배송으로 필요한 재료 받을 수 있어서 너무 좋아요,5,210116,롯데마트,0.0
농심 신라면,"여기저기 기웃거려도 결국에 신라면이 짱
종류별로 사다놔도 제일 먼저 사라지네요.",5,211119,이마트몰,0.0
농심 신라면,"만족스러워요
유통기한도 2023년 1월 4일로 길고
파손없이 잘 도착했어요
잘 먹을게요~!",5,220714,옥션,4.0
농심 신라면,"자주먹진 않지만, 없으면 안될것같은 신라면 구매했어요.잘먹을께요. 감사합니다.~",5,201125,G마켓,4.0
농심 신라면,"가격이 너무 싸서 유통기한 짧을줄 알았더니
정말 기네요~~ 계속 여기서 사야겠어용",5,200804,과자대장,0.0
농심 신라면,사진을 잘못찍었네요 ㅋ어차피 매운거는 똑같으니깐 그냥넘어가세요 둘다맛이나요,5,211025,11번가,3.5
농심 신라면,신라면은 늘 쟁여둬요. 가장 무난합니다. 여기서 암청 저렴하게 사서 너무 만족해요,5,220523,트레이더스,0.0
농심 신라면,"최고의 서비스, 오프라인 매장과 같네요. 집에 오는 시간은 더 빨라~!쿠폰 할인은 덤",5,220412,롯데마트,4.5
농심 신라면,5개월정도 남은 제품이 옵니다. 많이 사도 다 못먹으니 구매하시는 분들 참고하세요,5,210519,누리고 리테일,3.0
농심 신라면,포장이 뜯겨져 있어서 누가 먼저 열어봤는줄 알았어요. 배송은 빠른 편인거 같아요.,4,201226,롯데ON,0.0
농심 신라면,신라면 캠핑 갈 때 필수입니다. 간단하게 조리하기 제격이구요. 인기만점 메뉴에요~,5,221107,GS 프레시몰,4.0
농심 신라면,작은걸로 사다가 비상용으로 너무 자주 사길래 어차피 먹을거서 박스로 구매했어요,5,210422,Homeplus,0.0
농심 신라면,"제 삼십년지기 친구같은 라면 입니다.
가성비 값중에 값 ㅋ
배송,맛,가격 모두 착해요",5,200525,푸드앤리더스기프트,4.0
농심 신라면,"우리집 가족들이 제일 좋아하는 라면이예요
코로나로 마트가기 힘들어서 주문했어요
농심라면은 맛 보장이죠!",5,201218,플랜 88,5.0
농심 신라면,"스마일배송이라 빠르고 좋네요
자주 이용하는데요
이번엔 물량이 많아서 그런지
포장상태가 그닥 좋지 않네요~",5,200915,옥션,0.0
농심 신라면,배송도매우빠르고 라면은말할것도없이좋죠. 부셔막고끓여먹고투움바로도해먹고잘먹었어요. 감사합니당,5,210423,플랜 88,0.0
농심 신라면,"다음날 받아보았구요.제조날짜 얼마되지 않아 과자로 먹어도 바삭하고 맛있더라구요^^
저렴하게 잘산거 같아요",5,200103,농심직영몰,4.0
농심 신라면,배송은 제시간에 왔고 집에서 편하게 받을수 있어서 좋습니다. 커다란 종이백에 담아서 깨끗하게 보내주셨네요,4,200713,11번가,4.5
농심 신라면,항상 먹는거라 특별할건 없지만 양파와 상품이 같이와서 덕분에 구매한 제품이 흙범벅이라 물로 씻어야했어요,5,220715,SSG 새벽배송,0.0
농심 신라면,"당일 배송은 물론이거니와 몇시쯤 배송된다는 연락도 주시고^^
무엇보다 물건들이 너무 잘 포장되어져 있고 신선하고~^^
첨엔 반신반의하며 주문한건데 받아보고나니 괜한 고민했다 싶었어요",5,221208,이마트몰,4.0
농심 신라면,처음 이용해봤는데 진짜 편하고 배송도 원하는 시간에 갔다 주는 서비스가 최고입니다 기사님도 진철하시고 계속 이용해야겠네요,5,210905,Homeplus,5.0
농심 신라면,맛난 라면을 좋은 가격에 유통기한 여유있게~ 그런데 안타깝게 라면이 너무 많이 부서져 있네요..어떻게 하나 후...,4,200402,옥션,3.3333333333333335
농심 신라면,신라면멀티 동생이 좋아해서 자주 구매합니다. 홈플러스에서 다양한 상품들을 원하는 시간때에 배송받을수 있어서 만족합니다.,5,201221,11번가,0.0
농심 신라면,국민라면이잖아요. ^^넉넉히 쟁여두긴 했는데 언제 다 먹지?좀 나눠 먹어야할 듯요.,5,220226,G마켓,4.0
농심 신라면,"홈플러스 장보기로 샀는데 배송시간도 잘 지켜주시고, 깔끔한 포장 마음에 드네요.",5,220222,Homeplus,4.5
농심 신라면,면발도 그렇고 국물도 맛있어서 자꾸만 생각납니다추울때 뜨끈한 라면이 최고지요,5,200920,G마켓,5.0
농심 신라면,모든 물가가 오르듯 최애 라면도 마찬가지라 많이 구매했어요~~말이 필요없는 제품,5,220523,G마켓,0.0
농심 신라면,신라면을 신랑이 좋아해서 주말마다 먹으니 금방먹네용.가격이 올라서 ㅠ쫄깃해요,4,210906,11번가,2.0
농심 신라면,워낙 잘먹는 신라면 저렴하게 샀어요. 태풍소식에 비까지 내리는데 배송 감사해요!,5,220905,트레이더스,4.0
농심 신라면,"오뚜기만 막다 이걸로 바뀌고 첨엔 오랫만에 먹어 좀 그랬는데, 이거 아님 안 먹음",5,220520,이마트몰,0.0
농심 신라면,배송빠르고 가격대비 만족합니다.신라면 매콤이 진리네요.어른아이 다 잘먹는데요,5,220904,G마켓,4.0
농심 신라면,당연히 맛있죠.국물이 생각나서 어제 주문하고 오늘 배송 서비스로 수령했습니다.,5,220708,11번가,0.0
농심 신라면,"매장 물건 그대로! 짱 조아요!
포인트도 마니 쌓여서 네이버 장보기만 애용중이에여",5,220322,Homeplus,0.0
농심 신라면,"2묶음사면 할인되서 더 충동적으로 구매했는데
너무 잘 먹으니까 쟁여두기해야되요",5,210103,롯데ON,4.0
농심 신라면,"남푠이 늘 애정하고 먹던 라면이라 떨어질까봐
늘 구매해서 쟁겨두고 보관중입니다",4,221110,이마트몰,4.0
농심 신라면,"농심 신라면 외에는 잘 안사게
되더라고요 이것과 짜파게티는
항상 구매하고 있어요",5,210108,롯데마트,4.0
농심 신라면,이렇게 박스로 주문하다가 마트에서 사면 너무 비싸요유통기한도 넉넉하고 좋아요,5,210114,G마켓,4.0
농심 신라면,우리집 맛있는 간식!콩나물 넣고 만두 두게 넣으면 급할때 식사 대용으로도좋아요.,5,210304,G마켓,5.0
농심 신라면,개인적으로 신라면 좋아서 구매했는데 살수록 가격이 저렴해서 여러개 주문했어요,5,200614,롯데마트,5.0
농심 신라면,6개를 받을수있어서 좋은것같아요 새벽배송으로 빠르게 받으니 좋네요 만족합니다,5,210523,롯데마트,5.0
농심 신라면,빠른배송에 감사드려요 가족들이 신라면만 좋아하네요잘먹겠습니다 번창하세요~^^,5,191227,11번가,4.5
농심 신라면,무료 배송 에 유통기한 넉넉해서 좋아요 라면 먹어보니 마트 재품 보다 맛나요,5,220714,농심공식몰,0.0
농심 신라면,항상 먹던 라면을 싸게 구매했네요유통기한도 길고 아이들 방학인데 잘먹겠습니다,5,211231,11번가,4.0
농심 신라면,오랜만에 신라면 예전으보다 매운맛이 없는데해요 콩나물 넣어서 먹으면 맛있어요,5,210123,롯데마트,1.0
농심 신라면,저렴하게 샀어요 우리집은 무조건 신라면이라 항상 팬트리에 쟁여두는 물품입니다,5,220810,이마트몰,0.0
농심 신라면,네이버홈플 편하네요. 배송도빠르고 좋아요. 라면이야 떨어지지않게 사둬야지요~^^,5,220922,Homeplus,0.0
농심 신라면,신라면 가격이 폭등했네요 배송해 주셔서 진심 감사드려요 건강하시고 부자되세요,5,200227,옥션,3.3333333333333335
농심 신라면,울아들이 제일 좋아하는 농심~~~신라면맛있고 배송도 빠르고 싸고 아주 만족합니다,5,210715,11번가,5.0
농심 신라면,"먹고 싶을 때가 있어요.^^
청양고추 왕창 썰어 땀 삐질나게 먹으면 스트레스 풀려요.",5,200916,롯데마트,1.0
농심 신라면,배송도 빠르고 좋아요 유통기한때문에 항상 농심몰에서 안전하게 구매하고 있어용,5,211019,농심공식몰,0.0
농심 신라면,김장하려고 무랑 채소 기타 생필품 같이 주문했는데 일찍 가져다 주셔서 좋았어요!,5,211110,이마트몰,0.0
농심 신라면,라면가격이 많이 올랐는데 쿠폰적용하니 여기가 상대적으로 저렴해서 만족합니다.,5,211221,옥션,0.0
농심 신라면,아이들이 집에 있는 시간이 많다보니 자주 먹게 되네요. 매운맛이 적당하니 좋아요,5,210104,롯데마트,5.0
농심 신라면,언제 먹어도 든든한 국밥같은 느낌으로 먹는 라면. 근데 기름기가 좀 부담스럽긴해,5,220612,Homeplus,1.0
농심 신라면,초딩이 매운맛에 빠져서 주문했어요 김치도 못먹겠다더니 요즘은 신라면만 찾아요,5,211004,Homeplus,3.0
농심 신라면,언제나 구입하는 신라면 😍 제일 무난하게 먹을 수 있어서 항상 구비해 놓습니다,5,220703,이마트몰,1.0
농심 신라면,"농심 회사는 마음에 안 들지만,,, 라면 중엔 신라면이 제일 질리지 않고 맛있어요~ 면도 굵기나 식감이나 탄력 등등 제일 뛰어난 것 같구요~",5,210309,롯데마트,5.0
농심 신라면,"현재는 일부에 한하여 사용하고 있지만 건더기는 구미공장이나 안성공장 생산분 제품과 달리 현저히 적은 것이 함정입니다.

그래도 맛은 어느 정도 있지만 건더기 없이도 조리하여 먹기에는 물론 안성맞춤입니다.",5,201019,농심공식몰,2.0
농심 신라면,신라면이 맛있긴 한데.. 이번에 라면 시킨건 조금 홀쭉한것 같기도 하고 ㅎㅎ암튼 싼 가격에 아주 잘 산 것 같아요ㅎ,5,220325,11번가,4.0
농심 신라면,새벽배송상품을 현관을막고서 두면 어쩌자는겁니끼 계단굴러서 보냉가방 박스 다 떨어지고 계란이라도있었음 어떻게했을건데요 아니 그게아니더라도 굴러던져진음식 먹고싶어요? 정말 배송 개판이다 생각이란걸해요,1,210328,롯데마트,0.0
농심 신라면,언제나 애식하는 신라면..빅세일 기간을 이용하여 1박스나 샀는데 언제 다 먹을런지ㅎㅎ 욕심이 과했나요? 그래도 열심히 먹을께요,5,200529,옥션,3.3333333333333335
농심 신라면,"마트보다 가격이 저렴한편이 아니긴 하지만 텍배로
받을수 있어서 구입한 라면입니다.
얼큰하니 맛은 좋습니다",4,200328,옥션,0.0
농심 신라면,빨리왔어요!! ㅋㅋ완전 좋은건 유통기한이 아주 넉넉합니당 너무좋아요!!! 빨리 끓여먹고프네용! 고맙습니다^^,5,191217,위메프,4.5
농심 신라면,"가격도 저렴하고 배송도 매우 빨랐어요
유통기한도 길고 포장도 매우 꼼꼼히 잘 해서 만족합니다
재구매할게요",5,200925,옥션,4.0
농심 신라면,홈플러스 저희집까지 배달도되고 제품들도 신선하고 좋아요 육류는 아이스팩에 넣어 따로 넣어주시고 편해요,5,220503,Homeplus,0.0
농심 신라면,신라면을 좋아하고 가격도 착해서 주문했는데 라면이 너무 많이 부서져있어서 먹고난후 버려지는게 많네요 ㅠ,3,201005,G마켓,3.5
농심 신라면,잘받았습니다 스마일 배송 좋아요 이것저것 편하게 구입 해서 잘이용합니다 신라면은 항상 맛있죠잘 먹을께요,5,200621,G마켓,4.5
농심 신라면,신라면 안 먹다가도 생각나는 라면이죠 비오는데 배달 해주시느라 고생하신 기사님들 계셔서 항상 감사합니다,5,210906,롯데마트,0.0
농심 신라면,평소 즐겨먹는 라면이라 주문했는데 유통기한은 2020년 8월 26일까지네요. 면이 살짝 부서졌는지 봉지내에서 움직이는 부스러기 소리가 살짝 거슬리네요ㅜ,4,200302,롯데마트,3.5
농심 신라면,"요즘처럼 쌀쌀한 날씨에 딱 어울리는 신라면이예요
매운고추 작은거 1나정도 썰어넣고 계란풀어
먹으면 얼큰한 해장라면이 되요",5,201022,롯데마트,3.5
농심 신라면,"라면하면..역시신라면아닌가여?
신김치넣어서..버섯쩜너코..항상이리끊여서먹는데요..질리지도안코맛나요",5,220921,롯데마트,0.0
농심 신라면,우리신랑이 신라면 애호가 입니다 뉴스에 라면값 오른다고 해서 부지런히 아이쇼핑 하다가 져렴한 곳을찾앗네요 잘먹겟읍니다,5,220827,옥션,4.5
농심 신라면,"집에서 라면을 꽤 자주먹기도 하고 남편이랑 3개씩 끓여먹어서 금방 사라지네요~
박스에 차곡차곡 담겨져오기때문에 정리하기도 편하고 좋아요.",5,191224,SSG닷컴,5.0
농심 신라면,예전보다 덜매워진건 나의 내공인가.. 어쩔수없이 캡사이신 소스 한방울 첨가해서 먹어요. 진짜 맛있게 매워요,5,210301,롯데ON,5.0
농심 신라면,늘먹던제품이라말이필요없네요 다른라면보다면굵기도적절하고 국물맛도적당히매우면서깊은맛이있읍니다 강추네요~~^^,5,210116,롯데ON,0.0
농심 신라면,유통기한은 내년 5월 중순이후네요..아직 넉넉하게 남아있어요.. 다만 배송이 아주 빠르진 않아서 좀 아쉽네요...,3,191214,11번가,4.0
농심 신라면,오래되지 않아서 생라면으로도 먹기에 고소하고 바삭했어요.끓여먹어도 맛있네요,5,210729,롯데마트,0.0
농심 신라면,싸게 잘 사긴 한거 같은데 생각보다 배송이 너무 오랜 걸린거 같아서...실망이네요,3,201214,위메프,2.5
농심 신라면,"할인쿠폰 굿

맛있다 소문난 라면 다 먹어봐도 신라면이 최고 짱짱

가격을 진라면처럼 400원에 팔면 시장 점유율 99퍼이상 나올텐데",5,200703,SSG닷컴,4.666666666666667
농심 신라면,"언제ㅜ가격으루이리 올리셨나여...
좀.. 알려주시지.. 아니면 저만 몰랐나봐여 ㅜㅜ",4,210829,롯데ON,2.0
농심 신라면,2개사서 더 저렴하게 샀네요~ 라면은 항상 있어야하니.. 다음에 또 구입해야겠어요,5,220226,롯데ON,0.0
농심 신라면,"배송 빠르고 좋습니다ᆢ포장용 봉투에 적힌
감성적인 멘트도 좋아요ᆢ힘이 납니당",5,221111,이마트몰,0.0
농심 신라면,"신라면 좋아하는데 마침 20봉지짜리가 있어서 구매했어요!
박스로 배송되어오네요~",5,220913,Homeplus,0.0
농심 신라면,다양하게 구매할 수 있고 빠른 배송으로 원하는 시간에 받을 수 있어서 넘. 좋아오,5,220906,이마트몰,0.0
농심 신라면,코스트코에서 이렇게 한박스에 9900원에 샀었는데 이마트에도 있으니 너무 좋아요.,5,200717,SSG닷컴,0.0
농심 신라면,홈플러스에서 다양한 상품들을 원하는 시간때에 배송받을수 있어서 만족합니다...,5,200831,11번가,0.0
농심 신라면,"농심라면은 잘 구매하지 않는 편인데,오랜만에 주문해 봅니다. 아는 맛이라 딱히~~",5,200824,11번가,2.5
농심 신라면,"이마트 할인도 해주고 편하게 집에서 받아볼수 있어 너무 좋아여~~
감사합니당...^^*",5,220127,이마트몰,4.5
농심 신라면,"겨울이라 과감하게 한박스 구입해 봤어요
비상용 4명이서 급할때 먹어 보려구요~~",5,220205,SSG닷컴,1.0
농심 신라면,옛날맛은 이제 더이상 안나지만 그래도 집에 신라면 한봉지는 꼭 있어야해요 ㅎㅎ,5,200919,롯데마트,4.0
농심 신라면,"신라면이야 기본이죠! 전 적당히 매워서 너무 좋아합니다!
애아빠는 이것만 먹네요",5,210312,롯데마트,0.0
농심 신라면,없어서는 안될 비상식. 다름곳보다 저렴하네요. 저희집은 심라면 애호가라서...ㅎ,5,200506,롯데ON,0.0
농심 신라면,"농심라면이 오뚜기나 삼양보다 전체적으로 비쌈, 맛은 있음, 가격비교해서 구매함",5,191217,11번가,0.0
농심 신라면,라면가격이 오른다고 해서 미리 쟁여두려고 샀어요. 유통기한도 넉넉한 편입니다.,5,220926,SSG 새벽배송,4.0
농심 신라면,다른곳도 농심라면 2개이상 구매시 10%할인 해주던데 롯데마트가 가장 저렴하네요.,5,201009,롯데마트,4.0
농심 신라면,언제나 떨어지지 않게 사두고 있습니다. 라면 3개쯤 남으면 남편이 사라고 말해요.,5,220402,SSG닷컴,0.0
