keyword,review,star,date,site,score
농심 신라면,"다섯봉인줄 알고 샀는데 웬 박스가 와서 당황했네요ㅋㅋ
신라면 끓일 때마다 매워서 기침 나오는 거 빼고는 좋아요!",5,220328,SSG닷컴,2.0
농심 신라면,많이 느리네요우리지역까지 와서 출발을 안하고 하루가 지나서야 배송되었네요그래도 라면값오른다니 미리주문하기 잘한것같습니다.,5,210730,G마켓,4.0
농심 신라면,없으면 허전한 애들~!! 마트 갈일 없이 저렴하게 시켰어요!! ㅎㅎ 맛 평가 할게 있나요~ 유통기한 넉넉하고 적당히 먹으면서 살아야죠~~,5,220128,G마켓,3.3333333333333335
농심 신라면,편의점에서는 5개에 4500원 하던데 이정도면 싸게 구입한거겠죠.. 라면가격들이 다 틀리니 구매하는데 참고하세요 자주 구매해야겠어요,5,211006,11번가,0.0
농심 신라면,가격이 착해서 대용량으로 구매하고픈데.. 커서 매번 고민이었다가.. 집앞까지 배송해주시는 트레이더스 덕분에 구매했습니다. 유통기한도 넉넉합니다.,5,220519,트레이더스,0.0
농심 신라면,면 중앙이 움푹 들어가고 라면 끓이면 냄새가 더럽고 역거움 이런 불량라면을 재포장해서 파는 사람들은 어떤사람들인가요 환불요구합니다 아님 본사에 신고 할예정임,1,210509,농심공식몰,1.0
농심 신라면,"어려서부터 먹던 신라면..
근데 마트에서 파는거랑 맛이 살짝 다른느낌이에요..
그래도 저렴한가격에 잘 샀네요. 두고두고 잘 먹고있어요.",5,201023,SSG닷컴,4.0
농심 신라면,"배송은 빠른 것 같은데,,물품 재고가 없어 송장 에약후 2주 정도 후에 물품이 도착 했네요...아마도 라면값 인상으로 물품 확보에 어려움이 있었던거 같습니다...",5,210812,G마켓,1.0
농심 신라면,"요즘 롯데마트몰로 장보기하면 라면은 필수로 주문하는것같아요~ 칼칼한 라면은 역시 신라면^^
물건받자마자 마음급해서 겉봉지를 뜯어 정리해버려서 사진엔 없네요^^;",5,210629,롯데마트,3.0
농심 신라면,"박스가 한쪽 모서리가 뜯어져있어 혹시 흘렀을까 걱정했는데 테이프로 마감되어 별 문제는 없었어요.
제일 윗줄만 세어봤는데 수량은 문제없어보입니다.",5,220805,YesMall,1.0
농심 신라면,딴데는 박스에 송장 붙여오는데 여긴 겉에 한번더 비닐 포장을 해서 보내주셨네요. 처음이예요. 완전 감동입니다!!,5,201231,라비코코,5.0
농심 신라면,두 남자가 제일 애정하는 라면이라 떨어뜨리면 안되는 제품 중 하나입니다~~ 가격 행사 좀 많이 했으면 좋겠네요...,4,210516,롯데마트,4.0
농심 신라면,"사실 라면 다 똑같아서 특별히 할말이 없긴 한데, 그래도 배송도 정확하게 오고 박스도 깨끗해서 기분이 좋았어요.",5,201217,Homeplus,4.0
농심 신라면,정말 저렴하게 구매 했어요... 마침 라면이 똑 떨어져서 바닥이 보였는데배송도 빠르게 진행되어 아주 만족합니다.,5,220609,G마켓,0.0
농심 신라면,코로나 시기여서 마트가기도 좀 꺼려지는데 간편하게 배달로 장볼수 있어서 너무 좋아요~ 유통기한도 확실합니다.,5,201102,롯데마트,0.0
농심 신라면,아이들이 너무 좋아해서 5개 한팩씩만 꺼내놓고 먹어요마트보다 싸게사서 득탬했어요다음에도 수요일날 먹거리쿠폰 받아서 살꺼에요,5,210312,G마켓,0.0
농심 신라면,40여년의 역사를 가진 농심 신라면은 글로벌식품입니다.한국은 물론 일본.중국.미국 전세계인의 가슴을 시원하게 하는 정6동라면이지요,5,201220,G마켓,4.5
농심 신라면,"인터넷으로 라면주문하는거 고민많이했는데
하나도 안깨지고 깨끗하게왔네요
가격도착하고 유통기한도 넉넉하고
완전좋네요
다먹고 또구매할게요~~",5,200507,한로지,4.0
농심 신라면,너무 많이 먹어서 지겹긴하지만 다른 라면을 먹으면꼭 생각나는 라면이 신라면 입니다.매콤하고 얼큰한 국물에 쫄깃한 면발이너무 맛이 좋습니다. 오늘같이 비오는날따뜻한 라면 한그릇이 정말 딱이네요.너무 맛있습니다^^,5,220607,11번가,4.5
농심 신라면,홈플러스 온라인 장보기 항상 잘 이용하고 있습니다. 이번엔 행사기간이라 그런지 배달이 밀려 좀 늦게받았지만 그래두 편리하고 좋아용,5,220304,Homeplus,4.5
농심 신라면,항상 애용하는 라면인데 off-line 매장에는 없는 상품 내용이라 어떻게 배송되나 궁금했는데 받고 아주 만족하였습니다. 맛은 같고 앞으로 자주 이용하도록 하겠습니다.,5,221012,롯데ON,0.0
농심 신라면,"네이버 쇼핑 텐텐데이로 장보는게 가성비가 젤 좋네요 배송도 해주셔서 시간 절약도 되고요
신라면 잘 먹겠습니다",5,210704,Homeplus,4.0
농심 신라면,"잘 왔어요
네이버 홈플로 주문하면 이마트몰처럼 종이에 안 담겨오고 내용물을 그냥 집앞에 펼쳐놔서 불편해요ㅠ",5,201217,Homeplus,3.0
농심 신라면,농심 신라면~~ 두말하면 입아프죠~ 여러종류 라면이 있지만~ 오랜기간 이것 저것 먹어봐도~ 결론은~ 마침표는~ 신라면입니다~~ 마법가루로 사용하게~ 신라면 스프만 1회용으로 10개들이~ 팔면 좋겠습니다~~,5,210809,롯데마트,0.0
농심 신라면,라면도 떨어지고 박스채 사먹는게 편해 시켰드니 박스가 다 찢어져서 왔네요 배송은 빨랐어요바쁘시겠지만 물건은 소중히 다뤄주세요,4,210804,11번가,5.0
농심 신라면,엠티 가기 전에 온라인 주문해서 펜션으로 바로 받았어요! 지금처럼 코로나 시대에 언택트 쇼핑으로 원하는 시간대에 받아볼 수 있고 게다가 할인까지 받아서 너무 좋아요!,5,201125,롯데마트,4.0
농심 신라면,새벽배송이라 야채들과 육유등 유제품종류만 시켰는데요 라면도 떨어져 함께 주문했는데요~ 문앞까지 가져다 주셔서 넘 감사드립니다. 건강챙기세요^^,5,220610,SSG 새벽배송,4.333333333333333
농심 신라면,추운날씨에는 매운 신~~~라면 먹어야해요^^ 🔥타는 매운맛이 추위를 이겨내게 하겠죠 가격올랐던거 같은데 좀 저렴해서 좋았어요 ㅎㅎ,5,211018,Homeplus,3.0
농심 신라면,"가격 할인으로 구매.
국물이 식으면 기름기가 많이 느껴져서 느끼해요.
매운 고추와 콩나물 넣어 끓이면 괜찮아요.",4,211226,롯데마트,4.0
농심 신라면,라면 좋아해서 자주시키는데 라면은 역시 신ㅋ 묶음포장 없어서 은근 아쉽다가도 어차피 추가비닐포장이 사라지는게 환경에도 좋겠다 생각하게 되네요,5,220107,GS 프레시몰,2.0
농심 신라면,정해진 박스에 들어있어서 간단하니 좋네요 신라면이야 원래 맛있으니 맛은 보장된거고 두고먹기 좋을것 같아요,4,200228,옥션,0.0
농심 신라면,터지거나 부서지지않게 잘 배송받았어요. 신라면 싫어하는 사람없이 모두 좋아하잖아요. 유통기한도 넉넉합니다,5,211222,이마트몰,2.5
농심 신라면,비닐로 배송이 되다보니 아무래도 충격에 약하지 않나 싶네요. 바깥쪽에 있던 애를 뜯었는데 부스러기가 많아요.,5,220327,Homeplus,2.0
농심 신라면,유통기한 21.07.11 까지~ 계란탁 파송송해서 꼬들하게 끓여먹음 맛나쥬~^^ 신라면은 꼭 있어야 할 우리집 비상식량~~,5,210131,11번가,0.0
농심 신라면,"지난번에 한박스 주문한것보다 맛이 조금 눅눅하니 너무 딱딱하고 좀 이상했어요
겉포장에 손홍민 그림도없고 ~~~",5,200127,재형유통,0.0
농심 신라면,수요일 새벽에 구매했는데 금요일 받았어요유통기간은 길어서 좋아요타사제품보다 조금 더 느끼한맛은 있어도생라면은 더 맛있네요,4,210312,G마켓,0.0
농심 신라면,값싸고 좋은 품질 무겁게 안들고 다녀도 되고 롯데마트 라 안보고 사도 믿을수 있고 시간 아끼고 정말 좋아요 *^^*,5,200121,롯데마트,4.333333333333333
농심 신라면,"가격도 좋고 배송도 빠르고
궁금한점도 바로바로 잘응대해주셔서
믿고 구매할수 있었습니다
유통기한은 21년 4월6일
까지네요 참고하시고 구매하세요",5,201118,YS푸드,4.333333333333333
농심 신라면,"언제나 즐겨먹는 라면~
홈플 앱에서는 두개이상 할인이던데 네이버장보기에선 적용 안되서 아쉬웠어요
그래도 라면은 무조건 사야죠 ㅎ",5,220329,Homeplus,4.5
농심 신라면,팩으로 온거 다 뜯어서 정리해놓을때 흔들어봤는데 많이 부숴지지않고 잘 배송온거 같네요.유통기한은 받은날로부터 6~7개월 정도에요,5,200825,플랜 88,3.0
농심 신라면,"라면은 역시 신라면이 최고죠~~
다른 라면에 한눈 팔다가도 결국엔 신라면으로 돌아온다는ㅋ
30개 쿠폰써서 저렴하게 구매한것 같아요.
만족합니다.
유통기한은 원래 한6개월정도인가?
어쨌든 5개월정도 남았네요.",5,220208,트레이더스,5.0
농심 신라면,"언제먹어도맛있는신라면
바쁜생활에출출할때간단히챙겨먹을수있는
간식겸식사대용입니다 이마트행사에맞춰저렴하게쟁여놨어요",5,211031,이마트몰,5.0
농심 신라면,배송이 아주 빨랐어요. 포장 상태는 보통이고 (충전재가 있으면 좋겠어요 몇 개 부서진게 좀 있네요) 유통기한은 4~5개월 남아서 충분해요,4,220331,프리존 마켓,0.0
농심 신라면,빠른배송 감사하구요 신라면은 두말할 필요가없죠 온가족이 다 좋아하는 라면이라 40봉도 몇주면 끝나네요 맛있고 유효기한도 길어요,5,211218,11번가,5.0
농심 신라면,우리집은 신라면이 떨어지기전에 요렇게 주문하는데 집에서 그날그날 편하게 받을수있다보니 이젠 마트에 가는게 이상할것같아요~~^^,5,220129,GS 프레시몰,5.0
농심 신라면,신라면은 전국민 아이템 인것같네요 변하지 않는맛에 밥없을때나 밥이 있어도 다른게먹고싶을때 비상용으로 항상 비치해야되는 품목,5,210611,롯데마트,0.0
농심 신라면,포장도 꼼꼼하고 좋네요아랫칸 쪽에는 쪼금 찌그러졌던데중간에 보충재를 조금 넣어주시면 좋지 않을까 싶어요,5,200410,G마켓,4.0
농심 신라면,"원하는 시간에 배달받을 수 있어서 편해요
평소 먹던것들이라 모두 만족합니다
포장상태도 좋았어요
잘먹을게요):",5,220402,이마트몰,4.0
농심 신라면,"유통기한 넉넉하고 포장도 꼼꼼하게 에어캡 씌워서 보내주셨어요
선물용으로 구입한건데 배송상태 너무 좋아요~",5,200421,한빛유통몰,4.0
농심 신라면,"너무 감사해용
저렴한데다가 일부품목을 더하면 무료배송까지...
넘나 좋으네요
앞으로 간식은 요기서 하려구용~^^",5,210423,꿀마트,0.0
농심 신라면,아이들이 방학도 하고 아들만 셋인데맨날 라면만 끓여먹으니 1박스 사놔도 해퍼요.저렴한 가격에 잘 받았습니다,5,200108,G마켓,4.0
농심 신라면,인터넷 장보기에서 이것저것 같이 구입했네요. 주문한것중 빠진것도 있긴했지만 시간에 맞춰 잘 배달되었어요.,5,220801,11번가,4.0
농심 신라면,"구매후기도 좋고 고기 품질도 좋다해서요
쿠폰적용도 되니 가격도 더 저렴해지구요
집에까지 배달도 되고 좋네요",5,211107,옥션,5.0
농심 신라면,유통기한이 내년 6월이라 넉넉합니다 배송이 살짝 늦은감이 있지만 괜찮아요 쿠폰 이용해서 저렴하게 잘 샀어요,4,201218,11번가,4.0
농심 신라면,주문하고 받아보기까지 7일.. 출고가 늦어진것도 있지만 택배사도 4일이상 걸리는게 별로 맘에 들진 않았어요 ㅠ,2,201227,롯데ON,2.0
농심 신라면,원래 신라면은 늘 먹다가 최근에 안 먹었어서 구매해 봤습니다 근데 그 안에 먹긴 할텐데 유통기한이 좀 짧네요,4,220311,G마켓,1.0
농심 신라면,가격 나쁘지않고 배송 빠르게 왔어요 박스가 커서 놀랬는데 라면 부서지지 않게 충전재도 넣어져 있어 좋았네요,5,220826,옥션,0.0
농심 신라면,라면 너무 좋아하는 가족들을 위해 이젠 한박스가 적격이네요저렴해서 혹시 유통기한이 짧지는 않을까 했는데12월까지라 걱정없네요,5,200707,G마켓,3.0
농심 신라면,라면은역시 신라면이지요가끔 다른 라면도먹지만그래도 한결같이 쟁여놓는것은 신라면쿠폰 적용해서저렴하게 구입해서맛이 더 좋은것 같아요유통기한2020년7월2일 넉넉맛나게 잘먹고또 구입할께요~,5,200115,11번가,4.333333333333333
농심 신라면,"캠핑 갈 때, 필수로 챙겨가는 신라면. 빠르고 간편하게 조리해서 후딱 내놓으면 아이들이 더 좋아합니다. 캠핑 메뉴에 꽃이죠. 외국인 친구들도 너무 좋아합니다.스트레스 풀리는 매운맛! 맛있어용",5,220603,GS 프레시몰,3.0
농심 신라면,행사상품으로 특가로 잘샀네요~~ 손흥민선수 포장이 새로워 맘에 들었습니다. 비오는 주말..장마철에 뜨끈한 신라면은 정말 맛있네요.,5,200802,11번가,4.0
농심 신라면,이때 이것도 엄청 할인해서 샀다고 생각했는데 우와. 진짜 이번에 2+1은 한세트에 2455원 꼴인데 짱입니다 이마트,5,220106,SSG닷컴,4.0
농심 신라면,"번들이 아니라 낱개포장으로 30개가 와서 깜짝 놀랐습니다
저렴하게 구입하구 유통기한이 9월까지라 잘먹을께요",4,220503,옥션,4.0
농심 신라면,"아기 키우느라 마트 가는게 일인데.. 홈쁠 온라인 이용해서 빠른배송, 저렴한 가격, 깔끔한 포장 마음에 들어요~",5,220826,Homeplus,5.0
농심 신라면,"코로나땜시 시중에선 박스단위 구입이 안되요.
물량부족으로 조금 기다리긴했지만 만족합니다.
사업 번창하세요",5,200305,농심공식몰,0.0
농심 신라면,오홍 네0이버로 홈풀 첫주문인데 ㅎㅎ대박 편리하네요 친철하시고 꺌끔포장에 감동이네용 ㅎ자주이용해야겠음,5,210404,Homeplus,4.5
농심 신라면,신라면 떨어지면 왜이렇게 불안한지?아예 40봉 주문했더니 당분간 걱정 안해도 되겠어요.재구매 의사 있습니다.,5,220419,11번가,1.0
농심 신라면,가격 저렴하게 딜떠서 바로 샀어요비상식량으로 필수품이에요유통기한도 넉넉하네요..쓱배송 편리하고 좋아요,5,200802,11번가,5.0
농심 신라면,항상 기본으로 사먹는 라면이에요 배송시 박스가 쫌 찌그러져 오긴했네요 다음에는 좀 조심해주셨으면 합니다,5,220926,11번가,2.0
농심 신라면,"신라면 좋은가격에 잘샀어요
맛이야 더 말할 필요 없는거 같네요
유통기한도 넉넉한거 배달해주셔서 감사합니다",5,220130,롯데ON,4.5
농심 신라면,"배송도 빠르고 가격도 저렴해요
특히 쿠폰을 사용해서 아주 싸게 구매했어요
가장중요한건 라면맛이 일품입니다",5,211219,옥션,0.0
농심 신라면,"다소 신라면 농심이 가격은 올렸지만,워낙 잘만드는 회사라 믿고 사먹습니다. 누구나 질리지않는맛이죠.하하^-^",5,221117,이마트몰,4.0
농심 신라면,이번에는 신라면을 상자로 주문되어 있었죠. 예상과 달리 사고 없이 무사히 잘 도착한 것으로도 드러나고 있죠.,5,201219,농심공식몰,4.0
농심 신라면,"요즘같은 코로나시국에 집콕하다보니 라면 많이 먹게되서 마니 시켰어요..
2개이상 구입하니 할인받아 조으네용",5,220205,롯데ON,4.0
농심 신라면,"라면은... 신라면~^^
아이들이 집에 있는 시간이 많다보니 매끼 다 밥해먹기
힘들어서 라면도 귀찮을땐 끓여 주는데
봉지라면이 은근 헤퍼서 박스로~ 이게 뭐라고 든든해요~",5,201209,SSG닷컴,2.6666666666666665
농심 신라면,"주말에 트레이더스에갔는데 거기서는 30개를 비슷한 가격에 팔더라구요.
육아에 힘들때 숙취로 힘들때 든든한 한끼로 신라면 만한게 없죠! 감사합니다.",5,200713,옥션,1.0
농심 신라면,배송빠르고 가격저렴하게 잘샀습니다 유통기한도길고 박스가 아닌 종이백에 주셔서 박스분리수거배출의 귀찮음이 없어서좋아용~!!,5,201217,11번가,2.6666666666666665
농심 신라면,아~~~마트서는 5개에 3300원꼴인데 무배로 4천원이군요..제가 착각을해서..뭐 마트가는 수고는 덜었지만..뭔가 속은느낌..잘먹겠습니다,3,191228,농심공식몰,4.0
농심 신라면,"유효기간은5개월정도 남은걸로 받았네요..좀 짧다 생각이들지만 자주 라면 끓여먹으니 큰문제는 없을거 같아요
농심은 신라면이죠^ ^",4,210606,농심공식몰,2.0
농심 신라면,"포장은 공장도 세팅 그대로 잘 왔고요.
배송도 빠르게 도착했네요.
신라면이 이름값대로 맛도 좋네요.
가격도 저렴해서 가성비가 뛰어납니다.
많이 파세요.~",5,210820,으쓱몰,4.0
농심 신라면,항상 진라면만 먹었는데 아이가 신라면 맛이 궁금하다고 해서 스마일 배송하는 김에 한봉지 주문했습니다. 몇년만에 먹으니 좀 맵네요,5,201023,옥션,0.0
농심 신라면,보내지도 않은 물건인지 제가 받지도 못했는데 무슨 리뷰를 쓸까요? 도대체 직접배송은 어디로 어떻게 언제 진행됐는지 좀 알려주세요,1,210906,아임리사 스토어,3.0
농심 신라면,한번에 많은 품목을 주문했지만.양호하게 정확히 잘 받았네요. 미리 전화주시면 도와 드렸을텐데. . 기사님의 마지막 탄식이 아쉽네요,3,210710,롯데마트,2.5
농심 신라면,가격면에서 젤 저렴하네요. 다른 곳과 비교 해봐도 여기만한데가 없네요. 너구리만도 단독으로 판매하셨으면 좋겠어요. 잘 먹을게요~!,5,210917,11번가,4.0
농심 신라면,신라면은 말할 필요가 없죠 다른 싸이트보다 저렴하게 구입했고 유통기한도 적당하고 맛은 칼칼하니 좋습니다,5,210326,SSG닷컴,0.0
농심 신라면,가족들과 함께 먹으려고 구입했어요~스프냄새가 엄청 매워지긴한것 같은데 막상 먹을때는 많이 맵지는 않네요,5,210119,옥션,4.0
농심 신라면,빠르게 잘 받았습니다. 사무실에서 배고플 때 맛있게 끓여 먹으려구요. ^^ 유통기한은 3달 조금안되게 남았네요,5,211202,가연물류,4.333333333333333
농심 신라면,주말 점심에 먹으려고 사요 한번 끓일때 한봉지 다 먹어서 깔끔합니다 어쩔때 많이 사면 할인도 해줘서 좋아요,5,201023,롯데마트,4.0
농심 신라면,신라면 얼큰하구 면도 맛있네요 햄이나 참치 넣어서 한끼식사로 충분합니다 매운국물에 스팸 들어가니까 최고,5,201105,G마켓,5.0
농심 신라면,"일단 다른 곳보다 저렴하게 구입했고, 포장도 잘 되어있고 유통기한도 충분해서 걱정없이 맛있게 먹었습니다!!",5,200518,플랜 88,3.5
농심 신라면,100 원에. 구입해서 완전좋음.근데계산할때 다른쿠폰. 중복이 안되서 2번 따로결제하고 합포장 시켜서 번거러움,5,200116,롯데마트,5.0
농심 신라면,집에 있었는데 밖에서 퍽소리가 나서 놀라 나가보니 라면을 던져두고 가셨네요 부스러기 끓여먹으면 되나요..?,3,201220,팔자와 사자,0.0
농심 신라면,"배송도 늦지 않게오고, 꼼꼼하게 포장해주셔서, 온라인 쇼핑에 빠졌습니다! 상품 유통기간도 넉넉하고 좋아요!",5,220310,이마트몰,4.0
농심 신라면,"두 말 필요없는 국민 라면이죠.
이렇게 박스로는 처음 사보는데 손잡이까지 있어서 훨씬 편하더라고요. 좋아요.",5,200409,농심공식몰,0.0
농심 신라면,"언제나 옳은 신라면 근데 30봉지.
심지어 가겨도 저렴.
안 살 이유가 없음
비상싱량으로 최고.
한달은 거뜬할듯?",5,210127,SSG닷컴,4.5
농심 신라면,애정하는 신라면인데 이렇게 구입하는것이 저렴한줄 알았는데 뭐 그람당 비교하니까 똑같네요ㅋ 여튼 보관용으로 쟁여놓으려고 샀는데 딱 좋습니다.,5,210527,SSG닷컴,4.0
농심 신라면,"네이버 이마트몰 첫구매딜로 진짜 싸게 구매했어요!
박스에 차곡차곡 담겨 오니깐 자판기처럼 세워두고 먹기도 편하고 좋습니다
신라면 매콤하고 맛있어서 자주 먹는데 첫구매딜 덕분에 잘 사서 대만족입니다~~!",5,220829,이마트몰,4.666666666666667
농심 신라면,라면은 대체 왜이리 맛이 있을까요우리아이들만 집에 있을 때면 밥은 쳐다도 안보고 라면만 먹고 있네요라때는~ 그 마음을 알기에 슬쩍 구매해 놓습니다.,5,201106,11번가,1.0
농심 신라면,"푸라면은 20세기 최고의 발명품인거는 누구나 다 알고 있고!! 그맛은 21세기 들어서 전세계적으로 최고의 제품으로 인정 받고 있죠!!러시아,일본,동남아시아 지역에서 아주 큰인기를 받고 있습니다!!푸라면이여 영원하라!!",5,210623,농심공식몰,4.5
농심 신라면,유통기한 넉넉한걸로 빠르게 보내주셨어요~가격도 저렴하게~~신라면은 늘 구비해 놓는 필수품입니다. 청양고추 2개 썰어 넣고 끓여먹어요~감사합니다~,5,210226,G마켓,1.0
농심 신라면,"바쁜 생활속에 여차하면 마트에 장보러 가는걸 놓치게되고 요즘은 폐점시긴도 빨라져서 퇴근후 여유있게 장보기가 쉽지가 않더라고요
아침에 꼭 필요한 먹거리를 새벽배송으로 받으니 너무 편하네요.
포장싱태도 깜끔하고요.",5,210510,롯데마트,4.0
농심 신라면,"다른 라면도 맛있지만, 국물맛 있기는 신라면이 제격입니다. 행사가격 만큼 저렴하고, 좋네요. 잘 받았구요... 담에도 다시 구매할께요",4,210227,옥션,4.0
농심 신라면,최애 라면!!더이상 돈이없어 한끼대신한다...라는 말을 할 수 없어 슬픈 음식이네요. 원가가 있겠지만 더비싸지면 만나기 힘들것같아요,5,221001,이마트몰,1.0
농심 신라면,"롯데마트 청량리점에서 배송시 물품목록 꼭 확인하세요.인터넷주문 배달을 수십번도 더 시켜봤는데 연속해서 상품누락시키는 곳은 여기뿐이네요.
누락되었다고 고객센터 연락하니 다시보내주면 되지않냐는태도",1,210730,롯데마트,0.0
농심 신라면,라면 똑 떨어졌는데 잘 받았습니다.유통기한도 길고 ^^ 역시 믿고 먹어요.저렴한 가격에 빠른배송 감사드려요~,5,220212,G마켓,4.25
농심 신라면,신라면 가격이 오르고 양은 적고 해서 요즘 구입을 참고 있었는데...박스로 저렴하게 사서 쟁여놓으니 좋아요.,5,200812,SSG닷컴,0.0
농심 신라면,다른곳도 농심라면 2개이상 구매시 10%할인 해주던데 롯데마트가 가장 저렴하네요.이때 많이 쟁겨 놨습니다~~^^,5,201009,롯데마트,4.0
농심 신라면,"신라면 멀티5개입 X 8개 총40개
별점을 선택해주세요.
1점 별로에요. 2점 그냥그래요. 3점 보통이에요. 4점 맘에들어요. 5점 아주좋아요.",5,220201,옥션,0.0
농심 신라면,"주말에 같이 주문한 스마일배송 상품은 월욜 도착했는데 이건 이틀동안 방치했다가 옴
말만 담날 도착이군요
라면이 아닌 먹는 상품이었으면 반품했음",1,210707,옥션,0.0
농심 신라면,"라면값이 계속 오르네요ㅠ
스마일배송인데 다음날 안올때가 많아서 확실히 다음날 받아본다는 확신은 많이 떨어져서 여유롭게 주문해야 할 것 같아요",5,220906,옥션,2.0
농심 신라면,"칼칼한 맛이 좋아 늘 차자먹는 라면이죠. 신라면!!!^^
착한가격에 포장도 잘해 보내주셔서 받으며 기분 좋았어요~~
맛있게 먹겠습니다.",5,210822,라면킹,4.0
농심 신라면,유통기한적당하게좋고요 매번 인터넷으로 구매하는데 배송빨랐어요 근데 박스가 다 젖고 찢어져서왔는데 안에 내용물은 괸찮네요,5,210519,G마켓,4.0
농심 신라면,신라면 박스는 아니었지만 요기 상자에 꼼꼼하게 포장되서 (5개 들이 팩 8개로) 왔어요. 칼 배송이었고 유통기한 넉넉하고.. 아마 여기가 최저 가격이 아닌가 싶네요. 판매자님 감사해요. 번창하세요.,5,220902,솔깃유통,4.0
농심 신라면,항상 비상식품으로 있어야해요.. 비오는줄 모르고주문을 했는데 잘 배송해 주셔서 죄송스럽고감사했습니다..,5,220527,11번가,2.5
농심 신라면,이마트 배송은시간대 맞춰 배달잘되고포인트도 쌓이고..매장가서 사는것 비해 할인이나 구입조건이 좋아요~~,5,200913,11번가,4.0
농심 신라면,요즘 라면 값오른다해서 미리 구매했어요~~저렴히 잘산것같고 저렇게 박스잘라서 꺼내먹을수있어서좋아요~~~,5,210807,11번가,0.0
농심 신라면,마트보다 저렴하게 잘 구매했습니다! 다만 한 박스를 샀는데 유통기한 많이 넉넉하진 않아서 조금 아쉽네요.,4,201214,플랜 88,4.0
